mysql> USE 51zxw;
Database changed
mysql> desc user7;
+----------+-------------+------+-----+---------+-------+
| Field    | Type        | Null | Key | Default | Extra |
+----------+-------------+------+-----+---------+-------+
| userName | varchar(20) | NO   |     | NULL    |       |
| passWrod | varchar(20) | NO   |     | NULL    |       |
+----------+-------------+------+-----+---------+-------+
2 rows in set (0.01 sec)

mysql> select * from user7;
+----------+-----------+
| userName | passWrod  |
+----------+-----------+
| clive    | 123456    |
| 51zxw    | 124566    |
| zxw      | 123123123 |
| 小王     | xiaowang  |
| 小明     | xiaoming  |
| 小红     | xiaohong  |
| 老王     | laowang   |
+----------+-----------+
7 rows in set (0.00 sec)

mysql> DELETE FROM user7;
Query OK, 7 rows affected (0.00 sec)

mysql> select * from user7;
Empty set (0.00 sec)

mysql> select * from user6;
+----+----------+-----------+--------+------+
| id | userName | passWrod  | addr   | age  |
+----+----------+-----------+--------+------+
|  1 | clive    | 123456    | 成都   |   27 |
|  2 | 51zxw    | 124566    | 中国   | NULL |
|  3 | zxw      | 123123123 | 中国   | NULL |
|  4 | 小王     | xiaowang  | 北京   |   20 |
|  5 | 小明     | xiaoming  | 上海   |   25 |
|  6 | 小红     | xiaohong  | 深圳   |   18 |
|  7 | 老王     | laowang   | 成都   |   10 |
+----+----------+-----------+--------+------+
7 rows in set (0.00 sec)

mysql> DELETE FROM user6 WHERE id=7;
Query OK, 1 row affected (0.01 sec)

mysql> select * from user6;
+----+----------+-----------+--------+------+
| id | userName | passWrod  | addr   | age  |
+----+----------+-----------+--------+------+
|  1 | clive    | 123456    | 成都   |   27 |
|  2 | 51zxw    | 124566    | 中国   | NULL |
|  3 | zxw      | 123123123 | 中国   | NULL |
|  4 | 小王     | xiaowang  | 北京   |   20 |
|  5 | 小明     | xiaoming  | 上海   |   25 |
|  6 | 小红     | xiaohong  | 深圳   |   18 |
+----+----------+-----------+--------+------+
6 rows in set (0.00 sec)

mysql> DELETE FROM user6;
Query OK, 6 rows affected (0.00 sec)

mysql> select * from user6;
Empty set (0.00 sec)

mysql> INSERT user6(userName,passWrod) values('51zxw','124566');
Query OK, 1 row affected (0.00 sec)

mysql> select * from user6;
+----+----------+----------+--------+------+
| id | userName | passWrod | addr   | age  |
+----+----------+----------+--------+------+
|  8 | 51zxw    | 124566   | 中国   | NULL |
+----+----------+----------+--------+------+
1 row in set (0.00 sec)

mysql> DELETE FROM user6;
Query OK, 1 row affected (0.00 sec)

mysql> ALTER TABLE tal_name AUTO_INCREMENT=1;
ERROR 1146 (42S02): Table '51zxw.tal_name' doesn't exist
mysql> ALTER TABLE user6 AUTO_INCREMENT=1;
Query OK, 0 rows affected (0.01 sec)
Records: 0  Duplicates: 0  Warnings: 0

mysql> INSERT user6(userName,passWrod) values('51zxw','124566');
Query OK, 1 row affected (0.00 sec)

mysql> select * from user6;
+----+----------+----------+--------+------+
| id | userName | passWrod | addr   | age  |
+----+----------+----------+--------+------+
|  1 | 51zxw    | 124566   | 中国   | NULL |
+----+----------+----------+--------+------+
1 row in set (0.00 sec)

mysql> TRUNCATE user6;
Query OK, 0 rows affected (0.01 sec)

mysql> select * from user6;
Empty set (0.00 sec)

mysql> INSERT user6 values(1,'clive','123456','成都',27);
Query OK, 1 row affected (0.00 sec)

mysql> 
mysql> INSERT user6(userName,passWrod) values('51zxw','124566');
Query OK, 1 row affected (0.00 sec)

mysql> 
mysql> 
mysql> INSERT user6(passWrod,userName) values('123123123','zxw');
Query OK, 1 row affected (0.00 sec)

mysql> INSERT user6 values(4,'小王','xiaowang','北京',20),(5,'小明','xiaoming','上海',25),(6,'小红','xiaohong','深圳',18);
Query OK, 3 rows affected (0.00 sec)
Records: 3  Duplicates: 0  Warnings: 0

mysql> 
mysql> INSERT user6 SET id=7,userName='老王',passWrod='laowang',addr='成都',age=10;
Query OK, 1 row affected (0.00 sec)

mysql> select * from user6;
+----+----------+-----------+--------+------+
| id | userName | passWrod  | addr   | age  |
+----+----------+-----------+--------+------+
|  1 | clive    | 123456    | 成都   |   27 |
|  2 | 51zxw    | 124566    | 中国   | NULL |
|  3 | zxw      | 123123123 | 中国   | NULL |
|  4 | 小王     | xiaowang  | 北京   |   20 |
|  5 | 小明     | xiaoming  | 上海   |   25 |
|  6 | 小红     | xiaohong  | 深圳   |   18 |
|  7 | 老王     | laowang   | 成都   |   10 |
+----+----------+-----------+--------+------+
7 rows in set (0.00 sec)

mysql> UPDATE user6 SET age=100;
Query OK, 7 rows affected (0.00 sec)
Rows matched: 7  Changed: 7  Warnings: 0

mysql> select * from user6;
+----+----------+-----------+--------+------+
| id | userName | passWrod  | addr   | age  |
+----+----------+-----------+--------+------+
|  1 | clive    | 123456    | 成都   |  100 |
|  2 | 51zxw    | 124566    | 中国   |  100 |
|  3 | zxw      | 123123123 | 中国   |  100 |
|  4 | 小王     | xiaowang  | 北京   |  100 |
|  5 | 小明     | xiaoming  | 上海   |  100 |
|  6 | 小红     | xiaohong  | 深圳   |  100 |
|  7 | 老王     | laowang   | 成都   |  100 |
+----+----------+-----------+--------+------+
7 rows in set (0.00 sec)

mysql> UPDATE user6 SET age=99 WHERE userName='老王';
Query OK, 1 row affected (0.01 sec)
Rows matched: 1  Changed: 1  Warnings: 0

mysql> select * from user6;
+----+----------+-----------+--------+------+
| id | userName | passWrod  | addr   | age  |
+----+----------+-----------+--------+------+
|  1 | clive    | 123456    | 成都   |  100 |
|  2 | 51zxw    | 124566    | 中国   |  100 |
|  3 | zxw      | 123123123 | 中国   |  100 |
|  4 | 小王     | xiaowang  | 北京   |  100 |
|  5 | 小明     | xiaoming  | 上海   |  100 |
|  6 | 小红     | xiaohong  | 深圳   |  100 |
|  7 | 老王     | laowang   | 成都   |   99 |
+----+----------+-----------+--------+------+
7 rows in set (0.00 sec)

mysql> INSERT user6(userName,passWrod) values('老王','laowang');
Query OK, 1 row affected (0.00 sec)

mysql> select * from user6;
+----+----------+-----------+--------+------+
| id | userName | passWrod  | addr   | age  |
+----+----------+-----------+--------+------+
|  1 | clive    | 123456    | 成都   |  100 |
|  2 | 51zxw    | 124566    | 中国   |  100 |
|  3 | zxw      | 123123123 | 中国   |  100 |
|  4 | 小王     | xiaowang  | 北京   |  100 |
|  5 | 小明     | xiaoming  | 上海   |  100 |
|  6 | 小红     | xiaohong  | 深圳   |  100 |
|  7 | 老王     | laowang   | 成都   |   99 |
|  8 | 老王     | laowang   | 中国   | NULL |
+----+----------+-----------+--------+------+
8 rows in set (0.00 sec)

mysql> UPDATE user6 SET age=99 WHERE userName='老王';
Query OK, 1 row affected (0.00 sec)
Rows matched: 2  Changed: 1  Warnings: 0

mysql> select * from user6;
+----+----------+-----------+--------+------+
| id | userName | passWrod  | addr   | age  |
+----+----------+-----------+--------+------+
|  1 | clive    | 123456    | 成都   |  100 |
|  2 | 51zxw    | 124566    | 中国   |  100 |
|  3 | zxw      | 123123123 | 中国   |  100 |
|  4 | 小王     | xiaowang  | 北京   |  100 |
|  5 | 小明     | xiaoming  | 上海   |  100 |
|  6 | 小红     | xiaohong  | 深圳   |  100 |
|  7 | 老王     | laowang   | 成都   |   99 |
|  8 | 老王     | laowang   | 中国   |   99 |
+----+----------+-----------+--------+------+
8 rows in set (0.00 sec)

